{
  "totalEntries": 44,
  "totalAssessed": 43,
  "totalUndetermined": 1,
  "totalRetracted": 0,
  "measuredErrorRate": {
    "value": null,
    "unit": "ratio",
    "sampleSize": 44,
    "periodStart": "2026-06-15",
    "periodEnd": "2026-06-18",
    "method": "미측정(표본 부족)",
    "status": "unmeasured_insufficient_sample"
  },
  "correctionMetrics": {
    "openCorrectionRequests": 0,
    "acceptedCorrections": 0,
    "rejectedCorrections": 0,
    "staleCorrectionRequests": 0,
    "medianCorrectionLatencyDays": null,
    "latencyStatus": "no_requests_yet",
    "staleThresholdDays": 30
  },
  "externalAudits": [],
  "status": "unestablished"
}
